Author,URL,Title,Abstract,Keywords,Citations,Affiliation,Year,PictureURL
Srinivas Aluru,https://scholar.google.com/citations?user=YOGOScoAAAAJ,Identifying gene regulatory networks from gene expression data,Documents  Authors  Tables  Log in  Sign up  MetaCart  DMCA  Donate  CiteSeerX logo  Documents  Advanced Search Include Citations  Authors  Advanced Search Include Citations   Disambiguate  Tables  DMCA  Identifying gene regulatory networks from gene expression data  Cached  Download as a PDF  Download Links   www cs ucdavis edu    www cs sunysb edu    www hto usc edu   Save to List  Add to Collection  Correct Errors  Monitor Changes  by Vladimir Filkov  Citations         self  Summary  Citations  Active Bibliography  Co citation  Clustered Documents  Version History  BibTeX   MISC Filkov identifyinggene  author    Vladimir Filkov   title    Identifying gene regulatory networks from gene expression data   year         Share  Facebook  Twitter  Reddit  Bibsonomy  OpenURL  Abstract  Keyphrases  general property    ,Data Science/High performance Computing/Computational Biology/Combinatorial Scientific Computing,11082,Professor and Executive Director of Institute for Data Engineering and Science/ Georgia Tech,-1,https://scholar.google.com/citations?view_op=medium_photo&user=YOGOScoAAAAJ
Srinivas Aluru,https://scholar.google.com/citations?user=YOGOScoAAAAJ,A strategy for assembling the maize  Zea mays L   genome,   b Summary   b  Because the bulk of the maize   i Zea mays  i  L   genome consists of repetitive sequences  sequencing efforts are being targeted to its  gene rich  fraction  Traditional assembly programs are inadequate for this approach because they are optimized for a uniform sampling of the genome and inherently lack the ability to differentiate highly similar paralogs   div  Summary   b  Because the bulk of the maize   i Zea mays  i  L   genome consists of repetitive sequences  sequencing efforts are being targeted to its  gene rich  fraction  Traditional assembly programs are inadequate for this approach because they are optimized for a uniform sampling of the genome and inherently lack the ability to differentiate highly similar paralogs   div  Summary   b  Because the bulk of the maize   i Zea mays  i  L   genome consists of repetitive sequences  sequencing efforts are being targeted to its  gene rich  fraction  Traditional assembly programs are inadequate for this approach because they are optimized for a uniform sampling of the genome and inherently lack the ability to differentiate highly similar paralogs   div  Summary   b  Because the bulk of the maize   i Zea mays  i  L   genome consists of repetitive sequences  sequencing efforts are being targeted to its  gene rich  fraction  Traditional assembly programs are inadequate for this approach because they are optimized for a uniform sampling of the genome and inherently lack the ability to differentiate highly similar paralogs   div  Summary   b  Because the bulk of the maize   i Zea mays  i  L   genome consists of repetitive sequences  sequencing efforts are being targeted to its  gene rich  fraction  Traditional assembly programs are inadequate for this approach because they are optimized for a uniform sampling of the genome and inherently lack the ability to differentiate highly similar paralogs   div  Summary   b  Because the bulk of the maize   i Zea mays  i  L   genome consists of repetitive sequences  sequencing efforts are being targeted to its  gene rich  fraction  Traditional assembly programs are inadequate for this approach because they are optimized for a uniform sampling of the genome and inherently lack the ability to differentiate highly similar paralogs   div  Summary   b  Because the bulk of the maize   i Zea mays  i  L   genome consists of repetitive sequences  sequencing efforts are being targeted to its  gene rich  fraction  Traditional assembly programs are inadequate for this approach because they are optimized for a uniform sampling of the genome and inherently lack the ability to differentiate highly similar paralogs   div  Summary   b  Because the bulk of the maize   i Zea mays  i  L   genome consists of repetitive sequences  sequencing efforts are being targeted to its  gene rich  fraction  Traditional assembly programs are inadequate for this approach because they are optimized for a uniform sampling of the genome and inherently lack the ability to differentiate highly similar paralogs   div  Summary   b  Because the bulk of the maize   i Zea mays  i  L   genome consists of repetitive sequences  sequencing efforts are being targeted to its  gene rich  fraction  Traditional assembly programs are inadequate for this approach because they are optimized for a uniform sampling of the genome and inherently lack the ability to differentiate highly similar paralogs   div  Summary   b  Because the bulk of the maize   i Zea mays  i  L   genome consists of repetitive sequences  sequencing efforts are being targeted to its  gene rich  fraction  Traditional assembly programs are inadequate for this approach because they are optimized for a uniform sampling of the genome and inherently lack the ability to differentiate highly similar paralogs   div  Summary   b  Because the bulk of the maize   i Zea mays  i  L   genome consists of repetitive sequences  sequencing efforts are being targeted to its  gene rich  fraction  Traditional assembly programs are inadequate for this approach because they are optimized for a uniform sampling of the genome and inherently lack the ability to differentiate highly similar paralogs   div  Summary   b  Because the bulk of the maize   i Zea mays  i  L   genome consists of repetitive sequences  sequencing efforts are being targeted to its  gene rich  fraction  Traditional assembly programs are inadequate for this approach because they are optimized for a uniform sampling of the genome and inherently lack the ability to differentiate highly similar paralogs   div  Summary   b  Because the bulk of the maize   i Zea mays  i  L   genome consists of repetitive sequences  sequencing efforts are being targeted to its  gene rich  fraction  Traditional assembly programs are inadequate for this approach because they are optimized for a uniform sampling of the genome and inherently lack the ability to differentiate highly similar paralogs   div  Summary   b  Because the bulk of the maize   i Zea mays  i  L   genome consists of repetitive sequences  sequencing efforts are being targeted to its  gene rich  fraction  Traditional assembly programs are inadequate for this approach because they are optimized for a uniform sampling of the genome and inherently lack the ability to differentiate highly similar paralogs   div  Summary   b  Because the bulk of the maize   i Zea mays  i  L   genome consists of repetitive sequences  sequencing efforts are being targeted to its  gene rich  fraction  Traditional assembly programs are inadequate for this approach because they are optimized for a uniform sampling of the genome and inherently lack the ability to differentiate highly similar paralogs   div  Summary   b  Because the bulk of the maize   i Zea mays  i  L   genome consists of repetitive sequences  sequencing efforts are being targeted to its  gene rich  fraction  Traditional assembly programs are inadequate for this approach because they are optimized for a uniform sampling of the genome and inherently lack the ability to differentiate highly similar paralogs   div  Summary   b  Because the bulk of the maize   i Zea mays  i  L   genome consists of repetitive sequences  sequencing efforts are being targeted to its  gene rich  fraction  Traditional assembly programs are inadequate for this approach because they are optimized for a uniform sampling of the genome and inherently lack the ability to differentiate highly similar paralogs   div  Summary   b  Because the bulk of the maize   i Zea mays  i  L   genome consists of repetitive sequences  sequencing efforts are being targeted to its  gene rich  fraction  Traditional assembly programs are inadequate for this approach because they are optimized for a uniform sampling of the genome and inherently lack the ability to differentiate highly similar paralogs   div  Summary   b  Because the bulk of the maize   i Zea mays  i  L   genome consists of repetitive sequences  sequencing efforts are being targeted to its  gene rich  fraction  Traditional assembly programs are inadequate for this approach because they are optimized for a uniform sampling of the genome and inherently lack the ability to differentiate highly similar paralogs   div  Summary   b  Because the bulk of the maize   i Zea mays  i  L   genome consists of repetitive sequences  sequencing efforts are being targeted to its  gene rich  fraction  Traditional assembly programs are inadequate for this approach because they are optimized for a uniform sampling of the genome and inherently lack the ability to differentiate highly similar paralogs   div  Summary   b  Because the bulk of the maize   i Zea mays  i  L   genome consists of repetitive sequences  sequencing efforts are being targeted to its  gene rich  fraction  Traditional assembly programs are inadequate for this approach because they are optimized for a uniform sampling of the genome and inherently lack the ability to differentiate highly similar paralogs   div  Summary   b  Because the bulk of the maize   i Zea mays  i  L   genome consists of repetitive sequences  sequencing efforts are being targeted to its  gene rich  fraction  Traditional assembly programs are inadequate for this approach because they are optimized for a uniform sampling of the genome and inherently lack the ability to differentiate highly similar paralogs   div  Summary   b  Because the bulk of the maize   i Zea mays  i  L   genome consists of repetitive sequences  sequencing efforts are being targeted to its  gene rich  fraction  Traditional assembly programs are inadequate for this approach because they are optimized for a uniform sampling of the genome and inherently lack the ability to differentiate highly similar paralogs   div  Summary   b  Because the bulk of the maize   i Zea mays  i  L   genome consists of repetitive sequences  sequencing efforts are being targeted to its  gene rich  fraction  Traditional assembly programs are inadequate for this approach because they are optimized for a uniform sampling of the genome and inherently lack the ability to differentiate highly similar paralogs   div  Summary   b  Because the bulk of the maize   i Zea mays  i  L   genome consists of repetitive sequences  sequencing efforts are being targeted to its  gene rich  fraction  Traditional assembly programs are inadequate for this approach because they are optimized for a uniform sampling of the genome and inherently lack the ability to differentiate highly similar paralogs   div  Summary   b  Because the bulk of the maize   i Zea mays  i  L   genome consists of repetitive sequences  sequencing efforts are being targeted to its  gene rich  fraction  Traditional assembly programs are inadequate for this approach because they are optimized for a uniform sampling of the genome and inherently lack the ability to differentiate highly similar paralogs   div  Summary   b  Because the bulk of the maize   i Zea mays  i  L   genome consists of repetitive sequences  sequencing efforts are being targeted to its  gene rich  fraction  Traditional assembly programs are inadequate for this approach because they are optimized for a uniform sampling of the genome and inherently lack the ability to differentiate highly similar paralogs   div  Summary   b  Because the bulk of the maize   i Zea mays  i  L   genome consists of repetitive sequences  sequencing efforts are being targeted to its  gene rich  fraction  Traditional assembly programs are inadequate for this approach because they are optimized for a uniform sampling of the genome and inherently lack the ability to differentiate highly similar paralogs   div  Summary   b  Because the bulk of the maize   i Zea mays  i  L   genome consists of repetitive sequences  sequencing efforts are being targeted to its  gene rich  fraction  Traditional assembly programs are inadequate for this approach because they are optimized for a uniform sampling of the genome and inherently lack the ability to differentiate highly similar paralogs   div  Summary   b  Because the bulk of the maize   i Zea mays  i  L   genome consists of repetitive sequences  sequencing efforts are being targeted to its  gene rich  fraction  Traditional assembly programs are inadequate for this approach because they are optimized for a uniform sampling of the genome and inherently lack the ability to differentiate highly similar paralogs   div  Summary   b  Because the bulk of the maize   i Zea mays  i  L   genome consists of repetitive sequences  sequencing efforts are being targeted to its  gene rich  fraction  Traditional assembly programs are inadequate for this approach because they are optimized for a uniform sampling of the genome and inherently lack the ability to differentiate highly similar paralogs   div  Summary   b  Because the bulk of the maize   i Zea mays  i  L   genome consists of repetitive sequences  sequencing efforts are being targeted to its  gene rich  fraction  Traditional assembly programs are inadequate for this approach because they are optimized for a uniform sampling of the genome and inherently lack the ability to differentiate highly similar paralogs   div   div class  gsh csp    b Results   b  We report the development of bioinformatics tools for the accurate assembly of the maize genome  This software  which is based on innovative parallel algorithms to ensure scalability  assembled         genomic survey sequences fragments in   h using    Pentium III      GHz processors of a commodity cluster  Algorithmic innovations are used to reduce the number of pairwise alignments significantly without sacrificing quality  Clone pair information was used to estimate the error rate for improved differentiation of    div   div   div ,Data Science/High performance Computing/Computational Biology/Combinatorial Scientific Computing,11082,Professor and Executive Director of Institute for Data Engineering and Science/ Georgia Tech,-1,https://scholar.google.com/citations?view_op=medium_photo&user=YOGOScoAAAAJ
Srinivas Aluru,https://scholar.google.com/citations?user=YOGOScoAAAAJ,Space and time efficient parallel algorithms and software for EST clustering,Expressed sequence tags  abbreviated as ESTs  are DNA molecules experimentally derived from expressed portions of genes  Clustering of ESTs is essential for gene recognition and for understanding important genetic variations such as those resulting in diseases  We present the algorithmic foundations and implementation of PaCE  a parallel software system we developed for large scale EST clustering  The novel features of our approach include    design of space efficient algorithms to limit the space required to linear in the size of the input data set     a combination of algorithmic techniques to reduce the total work without sacrificing the quality of EST clustering  and    use of parallel processing to reduce runtime and facilitate clustering of large data sets  Using a combination of these techniques  we report the clustering of         rat ESTs in    minutes  and         Triticum aestivum ESTs in   hours and     ,Data Science/High performance Computing/Computational Biology/Combinatorial Scientific Computing,11082,Professor and Executive Director of Institute for Data Engineering and Science/ Georgia Tech,-1,https://scholar.google.com/citations?view_op=medium_photo&user=YOGOScoAAAAJ
Srinivas Aluru,https://scholar.google.com/citations?user=YOGOScoAAAAJ,Consensus genetic maps as median orders from inconsistent sources,A genetic map is an ordering of genetic markers calculated from a population of known lineage  Although  traditionally  a map has been generated from a single population for each species  recently  researchers have created maps from multiple populations  In the face of these new data  we address the need to find a consensus map   a map that combines the information from multiple partial and possibly inconsistent input maps  We model each input map as a partial order and formulate the consensus problem as finding a median partial order  Finding the median of multiple total orders  preferences or rankings  is a well studied problem in social choice  We choose to find the median by using the weighted symmetric difference distance  which is a more general version of both the symmetric difference distance and the Kemeny distance  Finding a median order using this distance is NP hard  We show that  for our  ,Data Science/High performance Computing/Computational Biology/Combinatorial Scientific Computing,11082,Professor and Executive Director of Institute for Data Engineering and Science/ Georgia Tech,-1,https://scholar.google.com/citations?view_op=medium_photo&user=YOGOScoAAAAJ
Srinivas Aluru,https://scholar.google.com/citations?user=YOGOScoAAAAJ,error,error,Data Science/High performance Computing/Computational Biology/Combinatorial Scientific Computing,11082,Professor and Executive Director of Institute for Data Engineering and Science/ Georgia Tech,-1,https://scholar.google.com/citations?view_op=medium_photo&user=YOGOScoAAAAJ
Srinivas Aluru,https://scholar.google.com/citations?user=YOGOScoAAAAJ,Parallel de novo assembly of large genomes from high throughput short reads,The advent of high throughput short read technology is revolutionizing life sciences by providing an inexpensive way to sequence genomes at high coverage  Exploiting this technology requires the development of a de novo short read assembler  which is an important open problem that is garnering significant research effort  Current methods are largely limited to microbial organisms  whose genomes are two to three orders of magnitude smaller than complex mammalian and plant genomes  In this paper  we present the design and development of a parallel de novo short read assembler that can scale to large genomes with high coverage  Our approach is based on the string graph formulation  Input reads are mapped to short paths  and the genome is reconstructed as a superpath anchored by distance constraints inferred from read pairs  Our method can handle a mixture of multiple read sizes and multiple paired  ,Data Science/High performance Computing/Computational Biology/Combinatorial Scientific Computing,11082,Professor and Executive Director of Institute for Data Engineering and Science/ Georgia Tech,-1,https://scholar.google.com/citations?view_op=medium_photo&user=YOGOScoAAAAJ
Srinivas Aluru,https://scholar.google.com/citations?user=YOGOScoAAAAJ,Parallel genomic alignments on the cell broadband engine,Genomic alignments  as a means to uncover evolutionary relationships among organisms  are a fundamental tool in computational biology  There is considerable recent interest in using the Cell Broadband Engine  a heterogeneous multicore chip that provides high performance  for biological applications  However  work in genomic alignments so far has been limited to computing optimal alignment scores using quadratic space for the basic global local alignment problem  In this paper  we present a comprehensive study of developing alignment algorithms on the Cell  exploiting its thread and data level parallelism features  First  we develop a parallel implementation on the Cell that computes optimal alignments and adopts Hirschberg s linear space technique  The former is essential  as merely computing optimal alignment scores is not useful  while the latter is needed to permit alignments of longer sequences  We  ,Data Science/High performance Computing/Computational Biology/Combinatorial Scientific Computing,11082,Professor and Executive Director of Institute for Data Engineering and Science/ Georgia Tech,-1,https://scholar.google.com/citations?view_op=medium_photo&user=YOGOScoAAAAJ
Srinivas Aluru,https://scholar.google.com/citations?user=YOGOScoAAAAJ,Scalable  memory efficient  high speed IP lookup algorithms,One of the central issues in router performance is IP address lookup based on longest prefix matching  IP address lookup algorithms can be evaluated on a number of metrics lookup time  update time  memory usage  and to a less important extent  the time to construct the data structure used to support lookups and updates  Many of the existing methods are geared toward optimizing a specific metric  and do not scale well with the ever expanding routing tables and the forthcoming IPv  where the IP addresses are     bits long  In contrast  our effort is directed at simultaneously optimizing multiple metrics and provide solutions that scale to IPv   with its longer addresses and much larger routing tables  In this paper  we present two IP address lookup schemes Elevator Stairs algorithm and logW Elevators algorithm  For a routing table with N prefixes  The Elevator Stairs algorithm uses optimal O N  memory  and  ,Data Science/High performance Computing/Computational Biology/Combinatorial Scientific Computing,11082,Professor and Executive Director of Institute for Data Engineering and Science/ Georgia Tech,-1,https://scholar.google.com/citations?view_op=medium_photo&user=YOGOScoAAAAJ
Srinivas Aluru,https://scholar.google.com/citations?user=YOGOScoAAAAJ,A fast approximate algorithm for mapping long reads to large reference databases, Emerging single molecule sequencing technologies from Pacific Biosciences and Oxford Nanopore have revived interest in long read mapping algorithms  Alignment based seed and extend methods demonstrate good accuracy  but face limited scalability  while faster alignment free methods typically trade decreased precision for efficiency  In this paper  we combine a fast approximate read mapping algorithm based on minimizers with a novel MinHash identity estimation technique to achieve both scalability and precision  In contrast to prior methods  we develop a mathematical framework that defines the types of mapping targets we uncover  establish probabilistic estimates of p value and sensitivity  and demonstrate tolerance for alignment error rates up to      With this framework  our algorithm automatically adapts to different minimum length and identity requirements and provides both positional and identity  ,Data Science/High performance Computing/Computational Biology/Combinatorial Scientific Computing,11082,Professor and Executive Director of Institute for Data Engineering and Science/ Georgia Tech,-1,https://scholar.google.com/citations?view_op=medium_photo&user=YOGOScoAAAAJ
Srinivas Aluru,https://scholar.google.com/citations?user=YOGOScoAAAAJ,error,error,Data Science/High performance Computing/Computational Biology/Combinatorial Scientific Computing,11082,Professor and Executive Director of Institute for Data Engineering and Science/ Georgia Tech,-1,https://scholar.google.com/citations?view_op=medium_photo&user=YOGOScoAAAAJ
Srinivas Aluru,https://scholar.google.com/citations?user=YOGOScoAAAAJ,Distribution independent hierarchical algorithms for the N body problem, The N body problem is to simulate the motion of N particles under the influence of mutual force fields based on an inverse square law  Greengards algorithm claims to compute the cumulative force on each particle in O N  time for a fixed precision irrespective of the distribution of the particles  In this paper  we show that Greengards algorithm is distribution dependent and has a lower bound of  N log   N  in two dimensions and  N log   N  in three dimensions  We analyze the Greengard and Barnes Hut algorithms and show that they are unbounded for arbitrary distributions  We also present a truly distribution independent algorithm for the N body problem that runs in O N log N  time for any fixed dimension ,Data Science/High performance Computing/Computational Biology/Combinatorial Scientific Computing,11082,Professor and Executive Director of Institute for Data Engineering and Science/ Georgia Tech,-1,https://scholar.google.com/citations?view_op=medium_photo&user=YOGOScoAAAAJ
Srinivas Aluru,https://scholar.google.com/citations?user=YOGOScoAAAAJ,PARALLEL TCOFFEE  A parallel multiple sequence aligner ,In this paper we present a parallel implementation of T Coffee a widely used multiple sequence alignment package  Our software supports a majority of options provided by the sequential program  including the  D coffee mode  and uses a message passing paradigm to distribute computations and memory  The main stages of T Coffee  that is library generation and progressive alignment  have been parallelized and can be executed on distributed memory machines  Using our parallel software we report alignments of data sets consisting of hundreds of protein sequences  which is far beyond the capability of the sequential T Coffee program ,Data Science/High performance Computing/Computational Biology/Combinatorial Scientific Computing,11082,Professor and Executive Director of Institute for Data Engineering and Science/ Georgia Tech,-1,https://scholar.google.com/citations?view_op=medium_photo&user=YOGOScoAAAAJ
