Author,URL,Title,Abstract,Keywords,Citations,Affiliation,Year,PictureURL
Ghassan AlRegib,https://scholar.google.com/citations?user=7k5QSdoAAAAJ,Technology and tools to enhance distributed engineering education,While the ongoing information technology  IT  revolution is providing us with tremendous educational opportunities  educators and IT researchers face numerous obstacles and pedagogical questions  The Georgia Institute of Technology  Georgia Tech  has a long history in engineering education research and has developed and designed many different tools for instructor authoring  course capturing  indexing  and retrieval  Special attention has been applied to the design and deployment of distributed learning environments  This paper describes the environment and challenges facing Georgia Tech as it expands its campus worldwide while maintaining integration of faculty and students across these campuses  The focus is primarily on the problems of synchronous delivery to multiple sites with a description of how technology is currently being deployed in Georgia Tech s distance learning  DL  classrooms  as well  ,Machine Learning/Image and Video Processing/Perception and Scene Understanding/Computational Seismic Interpretation/Machine,3995,School of Electrical and Computer Engineering/ Georgia Tech,-1,https://scholar.google.com/citations?view_op=medium_photo&user=7k5QSdoAAAAJ
Srinivas Aluru,https://scholar.google.com/citations?user=YOGOScoAAAAJ,The B   maize genome  complexity  diversity  and dynamics,We report an improved draft nucleotide sequence of the     gigabase genome of maize  an important crop plant and model for biological research  Over        genes were predicted  of which       were placed on reference chromosomes  Nearly     of the genome is composed of hundreds of families of transposable elements  dispersed nonuniformly across the genome  These were responsible for the capture and amplification of numerous gene fragments and affect the composition  sizes  and positions of centromeres  We also report on the correlation of methylation poor regions with  i Mu  i  transposon insertions and recombination  and copy number variants with insertions and or deletions  as well as how uneven gene losses between duplicated regions were involved in returning an ancient allotetraploid to a genetically diploid state  These analyses inform and set the stage for further investigations to improve  Mu  i  transposon insertions and recombination  and copy number variants with insertions and or deletions  as well as how uneven gene losses between duplicated regions were involved in returning an ancient allotetraploid to a genetically diploid state  These analyses inform and set the stage for further investigations to improve  Mu  i  transposon insertions and recombination  and copy number variants with insertions and or deletions  as well as how uneven gene losses between duplicated regions were involved in returning an ancient allotetraploid to a genetically diploid state  These analyses inform and set the stage for further investigations to improve  Mu  i  transposon insertions and recombination  and copy number variants with insertions and or deletions  as well as how uneven gene losses between duplicated regions were involved in returning an ancient allotetraploid to a genetically diploid state  These analyses inform and set the stage for further investigations to improve  Mu  i  transposon insertions and recombination  and copy number variants with insertions and or deletions  as well as how uneven gene losses between duplicated regions were involved in returning an ancient allotetraploid to a genetically diploid state  These analyses inform and set the stage for further investigations to improve  Mu  i  transposon insertions and recombination  and copy number variants with insertions and or deletions  as well as how uneven gene losses between duplicated regions were involved in returning an ancient allotetraploid to a genetically diploid state  These analyses inform and set the stage for further investigations to improve  Mu  i  transposon insertions and recombination  and copy number variants with insertions and or deletions  as well as how uneven gene losses between duplicated regions were involved in returning an ancient allotetraploid to a genetically diploid state  These analyses inform and set the stage for further investigations to improve  Mu  i  transposon insertions and recombination  and copy number variants with insertions and or deletions  as well as how uneven gene losses between duplicated regions were involved in returning an ancient allotetraploid to a genetically diploid state  These analyses inform and set the stage for further investigations to improve  Mu  i  transposon insertions and recombination  and copy number variants with insertions and or deletions  as well as how uneven gene losses between duplicated regions were involved in returning an ancient allotetraploid to a genetically diploid state  These analyses inform and set the stage for further investigations to improve  Mu  i  transposon insertions and recombination  and copy number variants with insertions and or deletions  as well as how uneven gene losses between duplicated regions were involved in returning an ancient allotetraploid to a genetically diploid state  These analyses inform and set the stage for further investigations to improve  Mu  i  transposon insertions and recombination  and copy number variants with insertions and or deletions  as well as how uneven gene losses between duplicated regions were involved in returning an ancient allotetraploid to a genetically diploid state  These analyses inform and set the stage for further investigations to improve  Mu  i  transposon insertions and recombination  and copy number variants with insertions and or deletions  as well as how uneven gene losses between duplicated regions were involved in returning an ancient allotetraploid to a genetically diploid state  These analyses inform and set the stage for further investigations to improve  Mu  i  transposon insertions and recombination  and copy number variants with insertions and or deletions  as well as how uneven gene losses between duplicated regions were involved in returning an ancient allotetraploid to a genetically diploid state  These analyses inform and set the stage for further investigations to improve  Mu  i  transposon insertions and recombination  and copy number variants with insertions and or deletions  as well as how uneven gene losses between duplicated regions were involved in returning an ancient allotetraploid to a genetically diploid state  These analyses inform and set the stage for further investigations to improve  Mu  i  transposon insertions and recombination  and copy number variants with insertions and or deletions  as well as how uneven gene losses between duplicated regions were involved in returning an ancient allotetraploid to a genetically diploid state  These analyses inform and set the stage for further investigations to improve  Mu  i  transposon insertions and recombination  and copy number variants with insertions and or deletions  as well as how uneven gene losses between duplicated regions were involved in returning an ancient allotetraploid to a genetically diploid state  These analyses inform and set the stage for further investigations to improve  Mu  i  transposon insertions and recombination  and copy number variants with insertions and or deletions  as well as how uneven gene losses between duplicated regions were involved in returning an ancient allotetraploid to a genetically diploid state  These analyses inform and set the stage for further investigations to improve  Mu  i  transposon insertions and recombination  and copy number variants with insertions and or deletions  as well as how uneven gene losses between duplicated regions were involved in returning an ancient allotetraploid to a genetically diploid state  These analyses inform and set the stage for further investigations to improve  Mu  i  transposon insertions and recombination  and copy number variants with insertions and or deletions  as well as how uneven gene losses between duplicated regions were involved in returning an ancient allotetraploid to a genetically diploid state  These analyses inform and set the stage for further investigations to improve  Mu  i  transposon insertions and recombination  and copy number variants with insertions and or deletions  as well as how uneven gene losses between duplicated regions were involved in returning an ancient allotetraploid to a genetically diploid state  These analyses inform and set the stage for further investigations to improve  Mu  i  transposon insertions and recombination  and copy number variants with insertions and or deletions  as well as how uneven gene losses between duplicated regions were involved in returning an ancient allotetraploid to a genetically diploid state  These analyses inform and set the stage for further investigations to improve  Mu  i  transposon insertions and recombination  and copy number variants with insertions and or deletions  as well as how uneven gene losses between duplicated regions were involved in returning an ancient allotetraploid to a genetically diploid state  These analyses inform and set the stage for further investigations to improve  Mu  i  transposon insertions and recombination  and copy number variants with insertions and or deletions  as well as how uneven gene losses between duplicated regions were involved in returning an ancient allotetraploid to a genetically diploid state  These analyses inform and set the stage for further investigations to improve  Mu  i  transposon insertions and recombination  and copy number variants with insertions and or deletions  as well as how uneven gene losses between duplicated regions were involved in returning an ancient allotetraploid to a genetically diploid state  These analyses inform and set the stage for further investigations to improve  Mu  i  transposon insertions and recombination  and copy number variants with insertions and or deletions  as well as how uneven gene losses between duplicated regions were involved in returning an ancient allotetraploid to a genetically diploid state  These analyses inform and set the stage for further investigations to improve  Mu  i  transposon insertions and recombination  and copy number variants with insertions and or deletions  as well as how uneven gene losses between duplicated regions were involved in returning an ancient allotetraploid to a genetically diploid state  These analyses inform and set the stage for further investigations to improve  Mu  i  transposon insertions and recombination  and copy number variants with insertions and or deletions  as well as how uneven gene losses between duplicated regions were involved in returning an ancient allotetraploid to a genetically diploid state  These analyses inform and set the stage for further investigations to improve  Mu  i  transposon insertions and recombination  and copy number variants with insertions and or deletions  as well as how uneven gene losses between duplicated regions were involved in returning an ancient allotetraploid to a genetically diploid state  These analyses inform and set the stage for further investigations to improve  Mu  i  transposon insertions and recombination  and copy number variants with insertions and or deletions  as well as how uneven gene losses between duplicated regions were involved in returning an ancient allotetraploid to a genetically diploid state  These analyses inform and set the stage for further investigations to improve  Mu  i  transposon insertions and recombination  and copy number variants with insertions and or deletions  as well as how uneven gene losses between duplicated regions were involved in returning an ancient allotetraploid to a genetically diploid state  These analyses inform and set the stage for further investigations to improve  Mu  i  transposon insertions and recombination  and copy number variants with insertions and or deletions  as well as how uneven gene losses between duplicated regions were involved in returning an ancient allotetraploid to a genetically diploid state  These analyses inform and set the stage for further investigations to improve  Mu  i  transposon insertions and recombination  and copy number variants with insertions and or deletions  as well as how uneven gene losses between duplicated regions were involved in returning an ancient allotetraploid to a genetically diploid state  These analyses inform and set the stage for further investigations to improve    div   div   div ,Data Science/High performance Computing/Computational Biology/Combinatorial Scientific Computing,11082,Professor and Executive Director of Institute for Data Engineering and Science/ Georgia Tech,-1,https://scholar.google.com/citations?view_op=medium_photo&user=YOGOScoAAAAJ
Srinivas Aluru,https://scholar.google.com/citations?user=YOGOScoAAAAJ,High throughput ANI analysis of   K prokaryotic genomes reveals clear species boundaries,A fundamental question in microbiology is whether there is continuum of genetic diversity among genomes  or clear species boundaries prevail instead  Whole genome similarity metrics such as Average Nucleotide Identity  ANI  help address this question by facilitating high resolution taxonomic analysis of thousands of genomes from diverse phylogenetic lineages  To scale to available genomes and beyond  we present FastANI  a new method to estimate ANI using alignment free approximate sequence mapping  FastANI is accurate for both finished and draft genomes  and is up to three orders of magnitude faster compared to alignment based approaches  We leverage FastANI to compute pairwise ANI values among all prokaryotic genomes available in the NCBI database  Our results reveal clear genetic discontinuity  with       of the total   billion genome pairs analyzed conforming to gt      intra species and lt   ,Data Science/High performance Computing/Computational Biology/Combinatorial Scientific Computing,11082,Professor and Executive Director of Institute for Data Engineering and Science/ Georgia Tech,-1,https://scholar.google.com/citations?view_op=medium_photo&user=YOGOScoAAAAJ
Srinivas Aluru,https://scholar.google.com/citations?user=YOGOScoAAAAJ,error,error,Data Science/High performance Computing/Computational Biology/Combinatorial Scientific Computing,11082,Professor and Executive Director of Institute for Data Engineering and Science/ Georgia Tech,-1,https://scholar.google.com/citations?view_op=medium_photo&user=YOGOScoAAAAJ
Srinivas Aluru,https://scholar.google.com/citations?user=YOGOScoAAAAJ,PCAP  a whole genome assembly program,We describe a whole genome assembly program named PCAP for processing tens  of millions of reads  The PCAP program has several features to address  efficiency and accuracy issues in assembly  Multiple processors are used to  perform most time consuming computations in assembly  A more sensitive method  is used to avoid missing overlaps caused by sequencing errors  Repetitive  regions of reads are detected on the basis of many overlaps with other reads   instead of many shorter word matches with other reads  Contaminated end  regions of reads are identified and removed  Generation of a consensus  sequence for a contig is based on an alignment of reads in the contig  in  which both base quality values and coverage information are used to determine  every consensus base  The PCAP program was tested on a mouse whole genome data  set of    million reads and a human Chromosome    data  ,Data Science/High performance Computing/Computational Biology/Combinatorial Scientific Computing,11082,Professor and Executive Director of Institute for Data Engineering and Science/ Georgia Tech,-1,https://scholar.google.com/citations?view_op=medium_photo&user=YOGOScoAAAAJ
Srinivas Aluru,https://scholar.google.com/citations?user=YOGOScoAAAAJ,Space efficient linear time construction of suffix arrays, We present a linear time algorithm to sort all the suffixes of a string over a large alphabet of integers  The sorted order of suffixes of a string is also called suffix array  a data structure introduced by Manber and Myers that has numerous applications in pattern matching  string processing  and computational biology  Though the suffix tree of a string can be constructed in linear time and the sorted order of suffixes derived from it  a direct algorithm for suffix sorting is of great interest due to the space requirements of suffix trees  Our result improves upon the best known direct algorithm for suffix sorting  which takes  i O  i   i n  i  log  i n  i   time  We also show how to construct suffix trees in linear time from our suffix sorting result  Apart from being simple and applicable for alphabets not necessarily of fixed size  this method of constructing suffix trees is more space efficient O  i   i n  i  log  i n  i   time  We also show how to construct suffix trees in linear time from our suffix sorting result  Apart from being simple and applicable for alphabets not necessarily of fixed size  this method of constructing suffix trees is more space efficient O  i   i n  i  log  i n  i   time  We also show how to construct suffix trees in linear time from our suffix sorting result  Apart from being simple and applicable for alphabets not necessarily of fixed size  this method of constructing suffix trees is more space efficient O  i   i n  i  log  i n  i   time  We also show how to construct suffix trees in linear time from our suffix sorting result  Apart from being simple and applicable for alphabets not necessarily of fixed size  this method of constructing suffix trees is more space efficient O  i   i n  i  log  i n  i   time  We also show how to construct suffix trees in linear time from our suffix sorting result  Apart from being simple and applicable for alphabets not necessarily of fixed size  this method of constructing suffix trees is more space efficient O  i   i n  i  log  i n  i   time  We also show how to construct suffix trees in linear time from our suffix sorting result  Apart from being simple and applicable for alphabets not necessarily of fixed size  this method of constructing suffix trees is more space efficient O  i   i n  i  log  i n  i   time  We also show how to construct suffix trees in linear time from our suffix sorting result  Apart from being simple and applicable for alphabets not necessarily of fixed size  this method of constructing suffix trees is more space efficient O  i   i n  i  log  i n  i   time  We also show how to construct suffix trees in linear time from our suffix sorting result  Apart from being simple and applicable for alphabets not necessarily of fixed size  this method of constructing suffix trees is more space efficient O  i   i n  i  log  i n  i   time  We also show how to construct suffix trees in linear time from our suffix sorting result  Apart from being simple and applicable for alphabets not necessarily of fixed size  this method of constructing suffix trees is more space efficient O  i   i n  i  log  i n  i   time  We also show how to construct suffix trees in linear time from our suffix sorting result  Apart from being simple and applicable for alphabets not necessarily of fixed size  this method of constructing suffix trees is more space efficient O  i   i n  i  log  i n  i   time  We also show how to construct suffix trees in linear time from our suffix sorting result  Apart from being simple and applicable for alphabets not necessarily of fixed size  this method of constructing suffix trees is more space efficient O  i   i n  i  log  i n  i   time  We also show how to construct suffix trees in linear time from our suffix sorting result  Apart from being simple and applicable for alphabets not necessarily of fixed size  this method of constructing suffix trees is more space efficient O  i   i n  i  log  i n  i   time  We also show how to construct suffix trees in linear time from our suffix sorting result  Apart from being simple and applicable for alphabets not necessarily of fixed size  this method of constructing suffix trees is more space efficient O  i   i n  i  log  i n  i   time  We also show how to construct suffix trees in linear time from our suffix sorting result  Apart from being simple and applicable for alphabets not necessarily of fixed size  this method of constructing suffix trees is more space efficient O  i   i n  i  log  i n  i   time  We also show how to construct suffix trees in linear time from our suffix sorting result  Apart from being simple and applicable for alphabets not necessarily of fixed size  this method of constructing suffix trees is more space efficient O  i   i n  i  log  i n  i   time  We also show how to construct suffix trees in linear time from our suffix sorting result  Apart from being simple and applicable for alphabets not necessarily of fixed size  this method of constructing suffix trees is more space efficient O  i   i n  i  log  i n  i   time  We also show how to construct suffix trees in linear time from our suffix sorting result  Apart from being simple and applicable for alphabets not necessarily of fixed size  this method of constructing suffix trees is more space efficient O  i   i n  i  log  i n  i   time  We also show how to construct suffix trees in linear time from our suffix sorting result  Apart from being simple and applicable for alphabets not necessarily of fixed size  this method of constructing suffix trees is more space efficient O  i   i n  i  log  i n  i   time  We also show how to construct suffix trees in linear time from our suffix sorting result  Apart from being simple and applicable for alphabets not necessarily of fixed size  this method of constructing suffix trees is more space efficient O  i   i n  i  log  i n  i   time  We also show how to construct suffix trees in linear time from our suffix sorting result  Apart from being simple and applicable for alphabets not necessarily of fixed size  this method of constructing suffix trees is more space efficient O  i   i n  i  log  i n  i   time  We also show how to construct suffix trees in linear time from our suffix sorting result  Apart from being simple and applicable for alphabets not necessarily of fixed size  this method of constructing suffix trees is more space efficient O  i   i n  i  log  i n  i   time  We also show how to construct suffix trees in linear time from our suffix sorting result  Apart from being simple and applicable for alphabets not necessarily of fixed size  this method of constructing suffix trees is more space efficient O  i   i n  i  log  i n  i   time  We also show how to construct suffix trees in linear time from our suffix sorting result  Apart from being simple and applicable for alphabets not necessarily of fixed size  this method of constructing suffix trees is more space efficient O  i   i n  i  log  i n  i   time  We also show how to construct suffix trees in linear time from our suffix sorting result  Apart from being simple and applicable for alphabets not necessarily of fixed size  this method of constructing suffix trees is more space efficient O  i   i n  i  log  i n  i   time  We also show how to construct suffix trees in linear time from our suffix sorting result  Apart from being simple and applicable for alphabets not necessarily of fixed size  this method of constructing suffix trees is more space efficient O  i   i n  i  log  i n  i   time  We also show how to construct suffix trees in linear time from our suffix sorting result  Apart from being simple and applicable for alphabets not necessarily of fixed size  this method of constructing suffix trees is more space efficient O  i   i n  i  log  i n  i   time  We also show how to construct suffix trees in linear time from our suffix sorting result  Apart from being simple and applicable for alphabets not necessarily of fixed size  this method of constructing suffix trees is more space efficient O  i   i n  i  log  i n  i   time  We also show how to construct suffix trees in linear time from our suffix sorting result  Apart from being simple and applicable for alphabets not necessarily of fixed size  this method of constructing suffix trees is more space efficient O  i   i n  i  log  i n  i   time  We also show how to construct suffix trees in linear time from our suffix sorting result  Apart from being simple and applicable for alphabets not necessarily of fixed size  this method of constructing suffix trees is more space efficient O  i   i n  i  log  i n  i   time  We also show how to construct suffix trees in linear time from our suffix sorting result  Apart from being simple and applicable for alphabets not necessarily of fixed size  this method of constructing suffix trees is more space efficient O  i   i n  i  log  i n  i   time  We also show how to construct suffix trees in linear time from our suffix sorting result  Apart from being simple and applicable for alphabets not necessarily of fixed size  this method of constructing suffix trees is more space efficient O  i   i n  i  log  i n  i   time  We also show how to construct suffix trees in linear time from our suffix sorting result  Apart from being simple and applicable for alphabets not necessarily of fixed size  this method of constructing suffix trees is more space efficient   div   div   div ,Data Science/High performance Computing/Computational Biology/Combinatorial Scientific Computing,11082,Professor and Executive Director of Institute for Data Engineering and Science/ Georgia Tech,-1,https://scholar.google.com/citations?view_op=medium_photo&user=YOGOScoAAAAJ
